=== SYSTEM INFO ===
Date: Thu Jul 31 11:13:03 PM CEST 2025
Hostname: UbuntuOne
Kernel: Linux UbuntuOne 6.14.0-27-generic #27~24.04.1-Ubuntu SMP PREEMPT_DYNAMIC Tue Jul 22 17:38:49 UTC 2 x86_64 x86_64 x86_64 GNU/Linux
Distribution: Description:	Ubuntu 24.04.2 LTS
USB Utils Version: lsusb (usbutils) 017

=== USB DEVICES ===
Bus 001 Device 001: ID 1d6b:0002 Linux Foundation 2.0 root hub
Bus 002 Device 001: ID 1d6b:0003 Linux Foundation 3.0 root hub
Bus 003 Device 001: ID 1d6b:0002 Linux Foundation 2.0 root hub
Bus 003 Device 002: ID 05e3:0745 Genesys Logic, Inc. Logilink CR0012
Bus 003 Device 003: ID 1462:7c37 Micro Star International MYSTIC LIGHT 
Bus 003 Device 004: ID 05e3:0608 Genesys Logic, Inc. Hub
Bus 003 Device 005: ID 0cd5:0001 LabJack Corporation Labjack U12
Bus 004 Device 001: ID 1d6b:0003 Linux Foundation 3.0 root hub
Bus 005 Device 001: ID 1d6b:0002 Linux Foundation 2.0 root hub
Bus 005 Device 002: ID 256f:c652 3Dconnexion Universal Receiver
Bus 005 Device 003: ID 413c:301c Dell Computer Corp. Dell Universal Receiver
Bus 006 Device 001: ID 1d6b:0003 Linux Foundation 3.0 root hub

=== LABJACK U12 USB DETAILS ===

Bus 003 Device 005: ID 0cd5:0001 LabJack Corporation Labjack U12
Device Descriptor:
  bLength                18
  bDescriptorType         1
  bcdUSB               1.10
  bDeviceClass            0 [unknown]
  bDeviceSubClass         0 [unknown]
  bDeviceProtocol         0 
  bMaxPacketSize0         8
  idVendor           0x0cd5 LabJack Corporation
  idProduct          0x0001 Labjack U12
  bcdDevice            5.f6
  iManufacturer           1 LabJack
  iProduct                2 Labjack U12
  iSerial                 0 
  bNumConfigurations      1
  Configuration Descriptor:
    bLength                 9
    bDescriptorType         2
    wTotalLength       0x0029
    bNumInterfaces          1
    bConfigurationValue     1
    iConfiguration          0 
    bmAttributes         0x80
      (Bus Powered)
    MaxPower              100mA
    Interface Descriptor:
      bLength                 9
      bDescriptorType         4
      bInterfaceNumber        0
      bAlternateSetting       0
      bNumEndpoints           2
      bInterfaceClass         3 Human Interface Device
      bInterfaceSubClass      0 [unknown]
      bInterfaceProtocol      0 
      iInterface              0 
        HID Device Descriptor:
          bLength                 9
          bDescriptorType        33
          bcdHID               1.10
          bCountryCode            0 Not supported
          bNumDescriptors         1
          bDescriptorType        34 Report
          wDescriptorLength      75
          Report Descriptor: (length is 75)
            Item(Global): Usage Page, data= [ 0x01 ] 1
                            Generic Desktop Controls
            Item(Local ): Usage, data= [ 0x00 ] 0
                            Undefined
            Item(Main  ): Collection, data= [ 0x01 ] 1
                            Application
            Item(Local ): Usage, data= [ 0x00 ] 0
                            Undefined
            Item(Local ): Usage, data= [ 0x00 ] 0
                            Undefined
            Item(Global): Logical Minimum, data= [ 0x80 ] 128
            Item(Global): Logical Maximum, data= [ 0x7f ] 127
            Item(Global): Physical Minimum, data= [ 0x4f 0x67 0x00 0x00 ] 26447
            Item(Global): Physical Maximum, data= [ 0x00 0x02 0x03 0xff ] -16580096
            Item(Global): Report Size, data= [ 0x08 ] 8
            Item(Global): Report Count, data= [ 0x08 ] 8
            Item(Main  ): Input, data= [ 0x02 ] 2
                            Data Variable Absolute No_Wrap Linear
                            Preferred_State No_Null_Position Non_Volatile Bitfield
            Item(Local ): Usage, data= [ 0x00 ] 0
                            Undefined
            Item(Global): Logical Minimum, data= [ 0x80 ] 128
            Item(Global): Logical Maximum, data= [ 0x7f ] 127
            Item(Global): Physical Minimum, data= [ 0x00 0x01 0x01 0x00 ] 65792
            Item(Global): Physical Maximum, data= [ 0x03 0xff 0xff 0x03 ] 67108611
            Item(Global): Report Size, data= [ 0x08 ] 8
            Item(Global): Report Count, data= [ 0x08 ] 8
            Item(Main  ): Output, data= [ 0x02 ] 2
                            Data Variable Absolute No_Wrap Linear
                            Preferred_State No_Null_Position Non_Volatile Bitfield
            Item(Local ): Usage, data= [ 0x00 ] 0
                            Undefined
            Item(Global): Logical Minimum, data= [ 0x80 ] 128
            Item(Global): Logical Maximum, data= [ 0x7f ] 127
            Item(Global): Physical Minimum, data= [ 0x00 0x00 0x02 0x01 ] 16908288
            Item(Global): Physical Maximum, data= [ 0x02 0x00 0xff 0x01 ] 33488898
            Item(Global): Report Size, data= [ 0x08 ] 8
            Item(Global): Report Count, data= [ 0x80 ] 128
            Item(Main  ): Feature, data= [ 0x02 ] 2
                            Data Variable Absolute No_Wrap Linear
                            Preferred_State No_Null_Position Non_Volatile Bitfield
            Item(Main  ): End Collection, data=none
      Endpoint Descriptor:
        bLength                 7
        bDescriptorType         5
        bEndpointAddress     0x81  EP 1 IN
        bmAttributes            3
          Transfer Type            Interrupt
          Synch Type               None
          Usage Type               Data
        wMaxPacketSize     0x0008  1x 8 bytes
        bInterval              10
      Endpoint Descriptor:
        bLength                 7
        bDescriptorType         5
        bEndpointAddress     0x02  EP 2 OUT
        bmAttributes            3
          Transfer Type            Interrupt
          Synch Type               None
          Usage Type               Data
        wMaxPacketSize     0x0008  1x 8 bytes
        bInterval              10
Device Status:     0x0000
  (Bus Powered)

=== USB DEVICE TREE ===

=== HID DEVICES ===
crw------- 1 root root 239, 0 Jul 31 22:58 /dev/hidraw0
crw------- 1 root root 239, 1 Jul 31 22:58 /dev/hidraw1
crw------- 1 root root 239, 2 Jul 31 22:58 /dev/hidraw2
crw------- 1 root root 239, 3 Jul 31 22:58 /dev/hidraw3
crw------- 1 root root 239, 4 Jul 31 22:58 /dev/hidraw4
crw------- 1 root root 239, 5 Jul 31 22:58 /dev/hidraw5
crw------- 1 root root 239, 6 Jul 31 22:58 /dev/hidraw6
crw------- 1 root root 239, 7 Jul 31 22:58 /dev/hidraw7
crw------- 1 root root 239, 8 Jul 31 22:58 /dev/hidraw8

=== DMESG LABJACK ENTRIES ===

